{
  "schema_version": "cambridge-research-1.0",
  "id": "cambridge-education-ba-hons",
  "university": {
    "name": "University of Cambridge",
    "identity_domain": "cam.ac.uk",
    "bts_university_id": 92862,
    "id_provenance": "user-provided; not checked against BTS"
  },
  "source_workbook": {
    "filename": "Cambridge_Undergraduate_BTS_Fields_2027_Research.xlsx",
    "sha256": "d9b1e732ddb36b1a13d846ef00c0f7e194e77b3d8ed1be93454ba6eae96e88d4",
    "sheet": "BTS Fields - 32 Courses",
    "row": 11
  },
  "program": {
    "title": "Education",
    "qualification": "BA (Hons)",
    "direct_program_url": null,
    "research_source_url": "https://www.undergraduate.study.cam.ac.uk/courses/a-z"
  },
  "bts_fields": {
    "program_title": {
      "value": "Education",
      "status": "workbook_reported",
      "source_cell": "A11",
      "review_note": "Reported by supplied workbook; independent official-source review pending."
    },
    "degree_level": {
      "value": "Bachelors",
      "status": "workbook_reported",
      "source_cell": "B11",
      "review_note": "Reported by supplied workbook; independent official-source review pending."
    },
    "school_name": {
      "value": null,
      "status": "unverified",
      "source_cell": null,
      "review_note": "Workbook names the university, not a program school or faculty."
    },
    "program_link": {
      "value": null,
      "status": "unverified",
      "source_cell": null,
      "review_note": "No supported workbook value."
    },
    "contact_university": {
      "value": null,
      "status": "unverified",
      "source_cell": null,
      "review_note": "No supported workbook value."
    },
    "degree_type": {
      "value": "BA (Hons)",
      "status": "workbook_reported",
      "source_cell": "F11",
      "review_note": "Reported by supplied workbook; independent official-source review pending."
    },
    "areas_of_study": {
      "value": "Education",
      "status": "workbook_reported",
      "source_cell": "G11",
      "review_note": "Reported by supplied workbook; independent official-source review pending."
    },
    "primary_area_of_study": {
      "value": "Education",
      "status": "workbook_reported",
      "source_cell": "H11",
      "review_note": "Reported by supplied workbook; independent official-source review pending."
    },
    "additional_areas_of_study": {
      "value": null,
      "status": "unverified",
      "source_cell": null,
      "review_note": "No supported workbook value."
    },
    "description_html": {
      "value": "<p>The University of Cambridge Education course covers education, learning, policy and interdisciplinary social sciences. Course-specific modules, teaching arrangements, and admissions requirements must be checked against the official Cambridge course page before publishing.</p>",
      "status": "workbook_reported",
      "source_cell": "J11",
      "review_note": "Reported by supplied workbook; independent official-source review pending."
    },
    "university_street": {
      "value": null,
      "status": "unverified",
      "source_cell": null,
      "review_note": "No supported workbook value."
    },
    "university_street_2": {
      "value": null,
      "status": "unverified",
      "source_cell": null,
      "review_note": "No supported workbook value."
    },
    "university_postal_code": {
      "value": null,
      "status": "unverified",
      "source_cell": null,
      "review_note": "No supported workbook value."
    },
    "university_city": {
      "value": "Cambridge",
      "status": "workbook_reported",
      "source_cell": "N11",
      "review_note": "Reported by supplied workbook; independent official-source review pending."
    },
    "university_region": {
      "value": "Cambridgeshire",
      "status": "workbook_reported",
      "source_cell": "O11",
      "review_note": "Reported by supplied workbook; independent official-source review pending."
    },
    "university_country": {
      "value": "United Kingdom",
      "status": "workbook_reported",
      "source_cell": "P11",
      "review_note": "Reported by supplied workbook; independent official-source review pending."
    },
    "university_latitude": {
      "value": null,
      "status": "unverified",
      "source_cell": null,
      "review_note": "No supported workbook value."
    },
    "university_longitude": {
      "value": null,
      "status": "unverified",
      "source_cell": null,
      "review_note": "No supported workbook value."
    },
    "program_street": {
      "value": null,
      "status": "unverified",
      "source_cell": null,
      "review_note": "No supported workbook value."
    },
    "program_street_2": {
      "value": null,
      "status": "unverified",
      "source_cell": null,
      "review_note": "No supported workbook value."
    },
    "program_postal_code": {
      "value": null,
      "status": "unverified",
      "source_cell": null,
      "review_note": "No supported workbook value."
    },
    "program_city": {
      "value": null,
      "status": "unverified",
      "source_cell": null,
      "review_note": "No supported workbook value."
    },
    "program_region": {
      "value": null,
      "status": "unverified",
      "source_cell": null,
      "review_note": "No supported workbook value."
    },
    "program_country": {
      "value": null,
      "status": "unverified",
      "source_cell": null,
      "review_note": "No supported workbook value."
    },
    "program_latitude": {
      "value": null,
      "status": "unverified",
      "source_cell": null,
      "review_note": "No supported workbook value."
    },
    "program_longitude": {
      "value": null,
      "status": "unverified",
      "source_cell": null,
      "review_note": "No supported workbook value."
    },
    "inherit_university_location": {
      "value": null,
      "status": "unverified",
      "source_cell": null,
      "review_note": "No supported workbook value."
    },
    "format": {
      "value": "Full Time",
      "status": "workbook_reported",
      "source_cell": "S11",
      "review_note": "Reported by supplied workbook; independent official-source review pending."
    },
    "attendance": {
      "value": "On Campus",
      "status": "workbook_reported",
      "source_cell": "U11",
      "review_note": "Reported by supplied workbook; independent official-source review pending."
    },
    "duration_original": {
      "value": {
        "amount": 3,
        "unit": "years"
      },
      "status": "workbook_reported",
      "source_cell": "Y11",
      "review_note": "Workbook route duration; integrated-degree and professional routes require individual course review."
    },
    "duration_bts": {
      "value": "3 years",
      "status": "workbook_reported",
      "source_cell": "X11",
      "review_note": "Normalized from workbook duration; course route requires review."
    },
    "tuition_home": {
      "value": {
        "amount": 10050,
        "currency": "GBP",
        "period": "year",
        "entry_year": 2027,
        "academic_year": null,
        "fee_status": "Home",
        "note": "Workbook amount only; annual University tuition. College fees excluded. Official 2027 source could not be accessed for independent verification."
      },
      "status": "workbook_reported",
      "source_cell": "Z11",
      "review_note": "2027 entry is stated in the workbook; exact academic-year label requires source review."
    },
    "tuition_non_eu": {
      "value": {
        "amount": 30798,
        "currency": "GBP",
        "period": "year",
        "entry_year": 2027,
        "academic_year": null,
        "fee_status": "Overseas",
        "note": "Workbook amount only; annual University tuition. College fees excluded. Official 2027 source could not be accessed for independent verification."
      },
      "status": "workbook_reported",
      "source_cell": "AA11",
      "review_note": "2027 entry is stated in the workbook; exact academic-year label requires source review."
    },
    "tuition_currency": {
      "value": "GBP",
      "status": "workbook_reported",
      "source_cell": "AA11",
      "review_note": "Currency is specified in workbook column heading."
    },
    "tuition_academic_year": {
      "value": null,
      "status": "unverified",
      "source_cell": null,
      "review_note": "Workbook states 2027 entry, but does not explicitly state an academic-year label."
    },
    "tuition_source_url": {
      "value": "https://www.undergraduate.study.cam.ac.uk/international-students/international-fees-and-costs",
      "status": "workbook_reported",
      "source_cell": "AZ11",
      "review_note": "Reported by supplied workbook; independent official-source review pending."
    },
    "tuition_last_verified": {
      "value": null,
      "status": "unverified",
      "source_cell": null,
      "review_note": "No independent official-source verification date."
    },
    "tuition_billing_period": {
      "value": "year",
      "status": "workbook_reported",
      "source_cell": "AA11",
      "review_note": "Annual basis is specified in workbook column heading."
    },
    "tuition_conversion": {
      "value": null,
      "status": "unverified",
      "source_cell": null,
      "review_note": "No supported workbook value."
    },
    "application_deadline": {
      "value": "15 October 2026 (2027 entry)",
      "status": "workbook_reported",
      "source_cell": "AB11",
      "review_note": "Reported by supplied workbook; independent official-source review pending."
    },
    "application_deadline_date": {
      "value": "2026-10-15",
      "status": "workbook_reported",
      "source_cell": "AC11",
      "review_note": "Reported by supplied workbook; independent official-source review pending."
    },
    "scholarship_deadline": {
      "value": null,
      "status": "unverified",
      "source_cell": null,